{
  "$schema": "https://json-schema.org/draft/2020-12/schema",
  "$id": "https://co-author-harness.local/schemas/f9_milestone_handoff.schema.json",
  "title": "F9 milestone handoff evidence",
  "type": "object",
  "additionalProperties": false,
  "required": [
    "artifact_family",
    "contract_version",
    "project",
    "lineage_id",
    "from_milestone",
    "to_milestone",
    "predecessor_packet",
    "deliverable",
    "released_export",
    "inputs_consumed",
    "decisions_frozen",
    "feedback_dispositions",
    "open_debts",
    "next_milestone_instructions",
    "approval"
  ],
  "properties": {
    "artifact_family": {
      "const": "F9"
    },
    "contract_version": {
      "const": "1.0.0"
    },
    "effect_scope": {
      "const": "proposal_only"
    },
    "project": {
      "type": "string",
      "minLength": 1
    },
    "lineage_id": {
      "type": "string",
      "minLength": 1
    },
    "from_milestone": {
      "enum": [
        "M1",
        "M2",
        "M3",
        "M4",
        "M5"
      ]
    },
    "to_milestone": {
      "type": [
        "string",
        "null"
      ],
      "enum": [
        "M2",
        "M3",
        "M4",
        "M5",
        null
      ]
    },
    "predecessor_packet": {
      "anyOf": [
        {
          "$ref": "#/$defs/binding"
        },
        {
          "type": "null"
        }
      ]
    },
    "deliverable": {
      "$ref": "#/$defs/deliverable"
    },
    "released_export": {
      "anyOf": [
        {"$ref": "#/$defs/export_binding"},
        {"type": "null"}
      ]
    },
    "inputs_consumed": {
      "type": "array",
      "items": {
        "$ref": "#/$defs/binding"
      }
    },
    "decisions_frozen": {
      "type": "array",
      "items": {
        "type": "string",
        "minLength": 1
      }
    },
    "feedback_dispositions": {
      "type": "array",
      "items": {
        "$ref": "#/$defs/feedback_disposition"
      }
    },
    "open_debts": {
      "type": "array",
      "items": {
        "type": "string",
        "minLength": 1
      }
    },
    "next_milestone_instructions": {
      "type": "array",
      "items": {
        "type": "string",
        "minLength": 1
      }
    },
    "approval": {
      "$ref": "#/$defs/approval"
    },
    "policy_evidence": {
      "anyOf": [{"$ref": "#/$defs/policy_evidence"}, {"type": "null"}]
    }
  },
  "allOf": [
    {
      "if": {
        "required": [
          "from_milestone"
        ],
        "properties": {
          "from_milestone": {
            "const": "M1"
          }
        }
      },
      "then": {
        "properties": {
          "to_milestone": {
            "const": "M2"
          },
          "predecessor_packet": {
            "type": "null"
          }
        }
      }
    },
    {
      "if": {
        "required": [
          "from_milestone"
        ],
        "properties": {
          "from_milestone": {
            "const": "M2"
          }
        }
      },
      "then": {
        "properties": {
          "to_milestone": {
            "const": "M3"
          },
          "predecessor_packet": {
            "$ref": "#/$defs/binding"
          }
        }
      }
    },
    {
      "if": {
        "required": [
          "from_milestone"
        ],
        "properties": {
          "from_milestone": {
            "const": "M3"
          }
        }
      },
      "then": {
        "properties": {
          "to_milestone": {
            "const": "M4"
          },
          "predecessor_packet": {
            "$ref": "#/$defs/binding"
          }
        }
      }
    },
    {
      "if": {
        "required": [
          "from_milestone"
        ],
        "properties": {
          "from_milestone": {
            "const": "M4"
          }
        }
      },
      "then": {
        "properties": {
          "to_milestone": {
            "const": "M5"
          },
          "predecessor_packet": {
            "$ref": "#/$defs/binding"
          }
        }
      }
    },
    {
      "if": {
        "required": [
          "from_milestone"
        ],
        "properties": {
          "from_milestone": {
            "const": "M5"
          }
        }
      },
      "then": {
        "properties": {
          "to_milestone": {
            "type": "null"
          },
          "predecessor_packet": {
            "$ref": "#/$defs/binding"
          },
          "released_export": {
            "$ref": "#/$defs/export_binding"
          }
        }
      }
    },
    {
      "if": {
        "required": ["from_milestone"],
        "properties": {"from_milestone": {"enum": ["M1", "M2", "M3", "M4"]}}
      },
      "then": {
        "properties": {"released_export": {"type": "null"}}
      }
    }
  ],
  "$defs": {
    "sha256": {
      "type": "string",
      "pattern": "^[0-9a-f]{64}$"
    },
    "binding": {
      "type": "object",
      "additionalProperties": false,
      "required": [
        "path",
        "sha256"
      ],
      "properties": {
        "path": {
          "type": "string",
          "minLength": 1
        },
        "sha256": {
          "$ref": "#/$defs/sha256"
        }
      }
    },
    "deliverable": {
      "type": "object",
      "additionalProperties": false,
      "required": [
        "role",
        "path",
        "sha256",
        "bytes"
      ],
      "properties": {
        "role": {
          "const": "deliverable"
        },
        "path": {
          "type": "string",
          "minLength": 1
        },
        "sha256": {
          "$ref": "#/$defs/sha256"
        },
        "bytes": {
          "type": "integer",
          "minimum": 1
        }
      }
    },
    "export_binding": {
      "type": "object",
      "additionalProperties": false,
      "required": ["role", "path", "sha256", "bytes", "source_sha256"],
      "properties": {
        "role": {"const": "export"},
        "path": {"type": "string", "minLength": 1},
        "sha256": {"$ref": "#/$defs/sha256"},
        "bytes": {"type": "integer", "minimum": 1},
        "source_path": {"type": "string", "minLength": 1},
        "source_sha256": {"$ref": "#/$defs/sha256"}
      }
    },
    "feedback_disposition": {
      "type": "object",
      "additionalProperties": false,
      "required": [
        "feedback_id",
        "disposition",
        "rationale"
      ],
      "properties": {
        "feedback_id": {
          "type": "string",
          "minLength": 1
        },
        "disposition": {
          "enum": [
            "pending",
            "accepted",
            "partially_accepted",
            "rejected",
            "deferred",
            "informational"
          ]
        },
        "rationale": {
          "type": "string",
          "minLength": 1
        }
      }
    },
    "approval": {
      "type": "object",
      "additionalProperties": false,
      "required": [
        "authority",
        "evidence_path",
        "approved_at"
      ],
      "properties": {
        "authority": {
          "type": "string",
          "minLength": 1
        },
        "evidence_path": {
          "type": "string",
          "minLength": 1
        },
        "approved_at": {
          "type": "string",
          "minLength": 1
        }
      }
    },
    "policy_evidence": {
      "type": "object",
      "additionalProperties": false,
      "properties": {
        "intended_readers": {"type": "array", "minItems": 1, "items": {"type": "string", "minLength": 1}},
        "reader_model": {"$ref":"#/$defs/reader_model"},
        "profile_path": {"type": "string", "minLength": 1},
        "profile_sha256": {"$ref": "#/$defs/sha256"},
        "resolved_sha256": {"$ref": "#/$defs/sha256"},
        "attestation_view_pin": {"$ref": "#/$defs/sha256"},
        "exemplar_view_pin": {"$ref": "#/$defs/sha256"},
        "manuscript_sha256": {"$ref": "#/$defs/sha256"},
        "cycle_id": {"type": "string", "minLength": 1},
        "check8_path": {"type": "string", "minLength": 1},
        "check8_sha256": {"$ref": "#/$defs/sha256"},
        "aggregate_verdict": {"enum": ["CLEAN", "BORDERLINE", "MAJOR", "BLOCKER"]},
        "phase": {"enum": ["Ph2", "Ph3", "Ph4"]},
        "terminal_round_id": {"type": "string", "pattern": "^round_[0-9]{4}-[0-9]{2}-[0-9]{2}_[0-9]{3}$"},
        "bindings": {"type": "array", "minItems": 1, "items": {"type": "object", "additionalProperties": false, "required": ["role", "path", "sha256"], "properties": {"role": {"enum": ["g4_signoff", "ship_signoff", "final_round_report", "reflector_full", "f7_evidence", "events_log", "findings", "convergence_log"]}, "path": {"type": "string", "minLength": 1}, "sha256": {"$ref": "#/$defs/sha256"}}}},
        "wiki_grounding": {"type": "object", "additionalProperties": false, "required": ["evidence_path", "evidence_sha256"], "properties": {"evidence_path": {"type": "string", "minLength": 1}, "evidence_sha256": {"$ref": "#/$defs/sha256"}}},
        "wiki_grounding_opt_out": {"type": "object", "additionalProperties": false, "required": ["authority", "reason", "evidence_path", "evidence_sha256"], "properties": {"authority": {"enum": ["user", "advisor", "instructor"]}, "reason": {"type": "string", "minLength": 1}, "evidence_path": {"type": "string", "minLength": 1}, "evidence_sha256": {"$ref": "#/$defs/sha256"}}},
        "draft_generation": {"type": "object", "additionalProperties": false, "required": ["evidence_path", "evidence_sha256"], "properties": {"evidence_path": {"type": "string", "minLength": 1}, "evidence_sha256": {"$ref": "#/$defs/sha256"}}},
        "draft_evaluation": {"type": "object", "additionalProperties": false, "required": ["evidence_path", "evidence_sha256"], "properties": {"evidence_path": {"type": "string", "minLength": 1}, "evidence_sha256": {"$ref": "#/$defs/sha256"}}}
      }
    }
    ,"reader_model":{"type":"object","additionalProperties":false,"required":["audience_classes","imported_theory_registers","reading_task","register_class","source"],"properties":{"audience_classes":{"const":["IS scholar","software engineer","systems engineer","requirements engineer"]},"imported_theory_registers":{"const":["sociology","psychology","philosophy"]},"reading_task":{"const":"recover the argument's claims and their derivation on a single read, without leaving the page to look up a term"},"register_class":{"const":"domain-native"},"source":{"const":"M1 milestone reader declaration"}}}
  }
}
