{
  "approval": {
    "approved_at": "2026-07-19T00:00:08Z",
    "authority": "user",
    "evidence_path": "reviews/.harness/milestones/checkpoints/m2_approval.json"
  },
  "artifact_family": "F9",
  "contract_version": "1.0.0",
  "decisions_frozen": [
    "Freeze M2 synthetic decision."
  ],
  "deliverable": {
    "bytes": 387,
    "path": "milestones/M2_annotated_references.md",
    "role": "deliverable",
    "sha256": "9a37c5f81f60367abf798f64e37babf1db948b88e6703fb9c9a156b60031b062"
  },
  "feedback_dispositions": [
    {
      "disposition": "informational",
      "feedback_id": "m2-feedback-initial",
      "rationale": "Synthetic feedback was reviewed and requires no revision."
    }
  ],
  "from_milestone": "M2",
  "inputs_consumed": [],
  "lineage_id": "main",
  "next_milestone_instructions": [
    "Use accepted M2 evidence."
  ],
  "open_debts": [],
  "policy_evidence": {
    "assignment_receipt": {
      "evidence_path": "reviews/.harness/assignment/consumed/gate_receipt_M2_walk_initial.json",
      "evidence_sha256": "a97f33acdc974666197648b3391807e4b2973cf3ae2dde9b5d01ab9a6f0eca6a",
      "receipt_id": "772c848e-5d05-4360-82af-2c6c87a73ec7"
    },
    "draft_evaluation": {
      "evidence_path": "reviews/.harness/shipments/synthetic/m2_initial_evaluation.lifecycle.json",
      "evidence_sha256": "f019146ad6a24a43741ab84ed593d5bf0661fccbc493e37a0b3408f48036e75e"
    },
    "draft_generation": {
      "evidence_path": "reviews/.harness/shipments/synthetic/m2_initial_generation.lifecycle.json",
      "evidence_sha256": "dec909c32d7428d3226b6bae1a72384fd4860bd4a010d615fb5f11ff2ddbd812"
    },
    "scholarly_evaluation": {
      "evidence_path": "milestones/m2-initial-scholarly-evaluation.json",
      "evidence_sha256": "02de3ef9a52587a081e9ca30a8b5524a43c88bce9b09fd3ce1ceb467ea42a6a6"
    }
  },
  "predecessor_packet": {
    "path": "reviews/.harness/handoffs/M1_to_M2.json",
    "sha256": "de9f3380082e786afa261a193206b3426f8b2604196647de04fb006b2c124dbe"
  },
  "project": "walk",
  "released_export": null,
  "to_milestone": "M3"
}
