{
  "artifact_family": "F9",
  "contract_version": "1.0.0",
  "project": "smoke-project",
  "lineage_id": "main",
  "from_milestone": "M2",
  "to_milestone": "M3",
  "predecessor_packet": {
    "path": "reviews/.harness/handoffs/M1_packet.json",
    "sha256": "4e606c6101b1b59c9bbdb6ab9dfa4865a41698e050304d279999915783e45a4c"
  },
  "deliverable": {
    "role": "deliverable",
    "path": "research_notes/m2_deliverable.md",
    "sha256": "a4f408e50e83fab0ca89ddda2cff8e7779a38333dd34c1e9b7342bc5d4e4051e",
    "bytes": 329
  },
  "released_export": null,
  "inputs_consumed": [],
  "decisions_frozen": [],
  "feedback_dispositions": [
    {
      "feedback_id": "feedback-m2-1",
      "disposition": "informational",
      "rationale": "No blocking findings."
    }
  ],
  "open_debts": [],
  "next_milestone_instructions": [],
  "approval": {
    "authority": "user",
    "evidence_path": "reviews/m2_approval.md",
    "approved_at": "2026-07-13T18:00:00Z"
  },
  "policy_evidence": {
    "draft_generation": {
      "evidence_path": "reviews/.harness/verifier/terminal-m2/generation.lifecycle.json",
      "evidence_sha256": "249f4ac554be0e7f4068ad6d69ebf74246efac74f669cb2ce4ec4a0fec03e1f9"
    },
    "draft_evaluation": {
      "evidence_path": "reviews/.harness/verifier/terminal-m2/evaluation.lifecycle.json",
      "evidence_sha256": "0df2d68d6e512978800562af31783c52a9562d08d58cb058404785034169c0fe"
    },
    "scholarly_evaluation": {
      "evidence_path": "research_notes/terminal-m2-scholarly-evaluation.json",
      "evidence_sha256": "41a67fa082fe759a17b787e621b9e6963e41ac9cf9f915869a76f7a3882953f0"
    },
    "assignment_receipt": {
      "receipt_id": "2015e46e-331e-51e0-bacf-8b37960adff0",
      "evidence_path": "reviews/.harness/assignment/consumed/gate_receipt_M2_terminal-m2.json",
      "evidence_sha256": "aaf1e07b2e70649694c54b310ef6bcc02484b453edf709603a96e51351d6ff2b"
    }
  }
}